[
  {
    "name": "content-engine",
    "namespace": "docs",
    "path": "skills/docs/content-engine",
    "status": "VALID",
    "source_directory": "./skills/docs/"
  },
  {
    "name": "article-writing",
    "namespace": "docs",
    "path": "skills/docs/article-writing",
    "status": "VALID",
    "source_directory": "./skills/docs/"
  },
  {
    "name": "seo",
    "namespace": "docs",
    "path": "skills/docs/seo",
    "status": "VALID",
    "source_directory": "./skills/docs/"
  },
  {
    "name": "documentation-lookup",
    "namespace": "docs",
    "path": "skills/docs/documentation-lookup",
    "status": "VALID",
    "source_directory": "./skills/docs/"
  },
  {
    "name": "market-research",
    "namespace": "docs",
    "path": "skills/docs/market-research",
    "status": "VALID",
    "source_directory": "./skills/docs/"
  },
  {
    "name": "brand-voice",
    "namespace": "docs",
    "path": "skills/docs/brand-voice",
    "status": "VALID",
    "source_directory": "./skills/docs/"
  },
  {
    "name": "investor-materials",
    "namespace": "docs",
    "path": "skills/docs/investor-materials",
    "status": "VALID",
    "source_directory": "./skills/docs/"
  },
  {
    "name": "investor-outreach",
    "namespace": "docs",
    "path": "skills/docs/investor-outreach",
    "status": "VALID",
    "source_directory": "./skills/docs/"
  },
  {
    "name": "postgres-patterns",
    "namespace": "backend",
    "path": "skills/backend/postgres-patterns",
    "status": "VALID",
    "source_directory": "./skills/backend/"
  },
  {
    "name": "api-design",
    "namespace": "backend",
    "path": "skills/backend/api-design",
    "status": "VALID",
    "source_directory": "./skills/backend/"
  },
  {
    "name": "springboot-patterns",
    "namespace": "backend",
    "path": "skills/backend/springboot-patterns",
    "status": "VALID",
    "source_directory": "./skills/backend/"
  },
  {
    "name": "python-patterns",
    "namespace": "backend",
    "path": "skills/backend/python-patterns",
    "status": "VALID",
    "source_directory": "./skills/backend/"
  },
  {
    "name": "golang-patterns",
    "namespace": "backend",
    "path": "skills/backend/golang-patterns",
    "status": "VALID",
    "source_directory": "./skills/backend/"
  },
  {
    "name": "evm-token-decimals",
    "namespace": "backend",
    "path": "skills/backend/evm-token-decimals",
    "status": "VALID",
    "source_directory": "./skills/backend/"
  },
  {
    "name": "java-coding-standards",
    "namespace": "backend",
    "path": "skills/backend/java-coding-standards",
    "status": "VALID",
    "source_directory": "./skills/backend/"
  },
  {
    "name": "laravel-security",
    "namespace": "backend",
    "path": "skills/backend/laravel-security",
    "status": "VALID",
    "source_directory": "./skills/backend/"
  },
  {
    "name": "database-migrations",
    "namespace": "backend",
    "path": "skills/backend/database-migrations",
    "status": "VALID",
    "source_directory": "./skills/backend/"
  },
  {
    "name": "backend-patterns",
    "namespace": "backend",
    "path": "skills/backend/backend-patterns",
    "status": "VALID",
    "source_directory": "./skills/backend/"
  },
  {
    "name": "nestjs-patterns",
    "namespace": "backend",
    "path": "skills/backend/nestjs-patterns",
    "status": "VALID",
    "source_directory": "./skills/backend/"
  },
  {
    "name": "perl-patterns",
    "namespace": "backend",
    "path": "skills/backend/perl-patterns",
    "status": "VALID",
    "source_directory": "./skills/backend/"
  },
  {
    "name": "laravel-patterns",
    "namespace": "backend",
    "path": "skills/backend/laravel-patterns",
    "status": "VALID",
    "source_directory": "./skills/backend/"
  },
  {
    "name": "django-patterns",
    "namespace": "backend",
    "path": "skills/backend/django-patterns",
    "status": "VALID",
    "source_directory": "./skills/backend/"
  },
  {
    "name": "rust-patterns",
    "namespace": "backend",
    "path": "skills/backend/rust-patterns",
    "status": "VALID",
    "source_directory": "./skills/backend/"
  },
  {
    "name": "springboot-security",
    "namespace": "backend",
    "path": "skills/backend/springboot-security",
    "status": "VALID",
    "source_directory": "./skills/backend/"
  },
  {
    "name": "nodejs-keccak256",
    "namespace": "backend",
    "path": "skills/backend/nodejs-keccak256",
    "status": "VALID",
    "source_directory": "./skills/backend/"
  },
  {
    "name": "clickhouse-io",
    "namespace": "backend",
    "path": "skills/backend/clickhouse-io",
    "status": "VALID",
    "source_directory": "./skills/backend/"
  },
  {
    "name": "django-security",
    "namespace": "backend",
    "path": "skills/backend/django-security",
    "status": "VALID",
    "source_directory": "./skills/backend/"
  },
  {
    "name": "dotnet-patterns",
    "namespace": "backend",
    "path": "skills/backend/dotnet-patterns",
    "status": "VALID",
    "source_directory": "./skills/backend/"
  },
  {
    "name": "rust-testing",
    "namespace": "testing",
    "path": "skills/testing/rust-testing",
    "status": "VALID",
    "source_directory": "./skills/testing/"
  },
  {
    "name": "laravel-verification",
    "namespace": "testing",
    "path": "skills/testing/laravel-verification",
    "status": "VALID",
    "source_directory": "./skills/testing/"
  },
  {
    "name": "csharp-testing",
    "namespace": "testing",
    "path": "skills/testing/csharp-testing",
    "status": "VALID",
    "source_directory": "./skills/testing/"
  },
  {
    "name": "verification-loop",
    "namespace": "testing",
    "path": "skills/testing/verification-loop",
    "status": "VALID",
    "source_directory": "./skills/testing/"
  },
  {
    "name": "ai-regression-testing",
    "namespace": "testing",
    "path": "skills/testing/ai-regression-testing",
    "status": "VALID",
    "source_directory": "./skills/testing/"
  },
  {
    "name": "eval-harness",
    "namespace": "testing",
    "path": "skills/testing/eval-harness",
    "status": "VALID",
    "source_directory": "./skills/testing/"
  },
  {
    "name": "laravel-tdd",
    "namespace": "testing",
    "path": "skills/testing/laravel-tdd",
    "status": "VALID",
    "source_directory": "./skills/testing/"
  },
  {
    "name": "cpp-testing",
    "namespace": "testing",
    "path": "skills/testing/cpp-testing",
    "status": "VALID",
    "source_directory": "./skills/testing/"
  },
  {
    "name": "tdd-workflow",
    "namespace": "testing",
    "path": "skills/testing/tdd-workflow",
    "status": "VALID",
    "source_directory": "./skills/testing/"
  },
  {
    "name": "kotlin-testing",
    "namespace": "testing",
    "path": "skills/testing/kotlin-testing",
    "status": "VALID",
    "source_directory": "./skills/testing/"
  },
  {
    "name": "django-verification",
    "namespace": "testing",
    "path": "skills/testing/django-verification",
    "status": "VALID",
    "source_directory": "./skills/testing/"
  },
  {
    "name": "springboot-tdd",
    "namespace": "testing",
    "path": "skills/testing/springboot-tdd",
    "status": "VALID",
    "source_directory": "./skills/testing/"
  },
  {
    "name": "perl-testing",
    "namespace": "testing",
    "path": "skills/testing/perl-testing",
    "status": "VALID",
    "source_directory": "./skills/testing/"
  },
  {
    "name": "springboot-verification",
    "namespace": "testing",
    "path": "skills/testing/springboot-verification",
    "status": "VALID",
    "source_directory": "./skills/testing/"
  },
  {
    "name": "django-tdd",
    "namespace": "testing",
    "path": "skills/testing/django-tdd",
    "status": "VALID",
    "source_directory": "./skills/testing/"
  },
  {
    "name": "golang-testing",
    "namespace": "testing",
    "path": "skills/testing/golang-testing",
    "status": "VALID",
    "source_directory": "./skills/testing/"
  },
  {
    "name": "e2e-testing",
    "namespace": "testing",
    "path": "skills/testing/e2e-testing",
    "status": "VALID",
    "source_directory": "./skills/testing/"
  },
  {
    "name": "python-testing",
    "namespace": "testing",
    "path": "skills/testing/python-testing",
    "status": "VALID",
    "source_directory": "./skills/testing/"
  },
  {
    "name": "research-ops",
    "namespace": "workflows",
    "path": "skills/workflows/research-ops",
    "status": "VALID",
    "source_directory": "./skills/workflows/"
  },
  {
    "name": "hookify-rules",
    "namespace": "workflows",
    "path": "skills/workflows/hookify-rules",
    "status": "VALID",
    "source_directory": "./skills/workflows/"
  },
  {
    "name": "iterative-retrieval",
    "namespace": "workflows",
    "path": "skills/workflows/iterative-retrieval",
    "status": "VALID",
    "source_directory": "./skills/workflows/"
  },
  {
    "name": "project-flow-ops",
    "namespace": "workflows",
    "path": "skills/workflows/project-flow-ops",
    "status": "VALID",
    "source_directory": "./skills/workflows/"
  },
  {
    "name": "strategic-compact",
    "namespace": "workflows",
    "path": "skills/workflows/strategic-compact",
    "status": "VALID",
    "source_directory": "./skills/workflows/"
  },
  {
    "name": "knowledge-ops",
    "namespace": "workflows",
    "path": "skills/workflows/knowledge-ops",
    "status": "VALID",
    "source_directory": "./skills/workflows/"
  },
  {
    "name": "skill-stocktake",
    "namespace": "workflows",
    "path": "skills/workflows/skill-stocktake",
    "status": "VALID",
    "source_directory": "./skills/workflows/"
  },
  {
    "name": "dmux-workflows",
    "namespace": "workflows",
    "path": "skills/workflows/dmux-workflows",
    "status": "VALID",
    "source_directory": "./skills/workflows/"
  },
  {
    "name": "customer-billing-ops",
    "namespace": "automation",
    "path": "skills/automation/customer-billing-ops",
    "status": "VALID",
    "source_directory": "./skills/automation/"
  },
  {
    "name": "logistics-exception-management",